<?xml version="1.0" encoding="UTF-8"?>
<!ELEMENT config (configurations)+>
<!ELEMENT configurations (section)+>
<!ELEMENT section (member)+>
<!ATTLIST section
    name NMTOKEN #REQUIRED>
<!ELEMENT member (#PCDATA)>
<!ATTLIST member
    name NMTOKEN #REQUIRED>


